{
  "schema": "kobra.port-deny-list/1",
  "description": "Ports that browsers refuse to connect to, or that the operating system reserves. Consumed by BOTH the launcher (before binding) and the shell (before proposing a user-edited port), so a user-typed port fails with an explanation instead of an opaque net::ERR_UNSAFE_PORT after the browser opens. Spec Sections 6.4 and 6.5. Derived from the Fetch Standard's bad-port list plus OS-reserved ranges. This file is versioned with the launcher; see port-deny-list.schema.json.",
  "generated": "2026-09-13T00:00:00Z",
  "source": "https://fetch.spec.whatwg.org/#port-blocking + RFC 1700 well-known assignments",
  "ranges": [
    { "from": 1, "to": 1023, "reason": "privileged", "message": "Ports below 1024 are reserved for system services. Pick a port between 1024 and 49151." }
  ],
  "ports": [
    { "port": 1, "reason": "unsafe" }, { "port": 7, "reason": "unsafe" },
    { "port": 9, "reason": "unsafe" }, { "port": 11, "reason": "unsafe" },
    { "port": 13, "reason": "unsafe" }, { "port": 15, "reason": "unsafe" },
    { "port": 17, "reason": "unsafe" }, { "port": 19, "reason": "unsafe" },
    { "port": 20, "reason": "unsafe" }, { "port": 21, "reason": "unsafe" },
    { "port": 22, "reason": "unsafe" }, { "port": 23, "reason": "unsafe" },
    { "port": 25, "reason": "unsafe" }, { "port": 37, "reason": "unsafe" },
    { "port": 42, "reason": "unsafe" }, { "port": 43, "reason": "unsafe" },
    { "port": 53, "reason": "unsafe" }, { "port": 69, "reason": "unsafe" },
    { "port": 77, "reason": "unsafe" }, { "port": 79, "reason": "unsafe" },
    { "port": 87, "reason": "unsafe" }, { "port": 95, "reason": "unsafe" },
    { "port": 101, "reason": "unsafe" }, { "port": 102, "reason": "unsafe" },
    { "port": 103, "reason": "unsafe" }, { "port": 104, "reason": "unsafe" },
    { "port": 109, "reason": "unsafe" }, { "port": 110, "reason": "unsafe" },
    { "port": 111, "reason": "unsafe" }, { "port": 113, "reason": "unsafe" },
    { "port": 115, "reason": "unsafe" }, { "port": 117, "reason": "unsafe" },
    { "port": 119, "reason": "unsafe" }, { "port": 123, "reason": "unsafe" },
    { "port": 135, "reason": "unsafe" }, { "port": 137, "reason": "unsafe" },
    { "port": 139, "reason": "unsafe" }, { "port": 143, "reason": "unsafe" },
    { "port": 161, "reason": "unsafe" }, { "port": 179, "reason": "unsafe" },
    { "port": 389, "reason": "unsafe" }, { "port": 427, "reason": "unsafe" },
    { "port": 465, "reason": "unsafe" }, { "port": 512, "reason": "unsafe" },
    { "port": 513, "reason": "unsafe" }, { "port": 514, "reason": "unsafe" },
    { "port": 515, "reason": "unsafe" }, { "port": 526, "reason": "unsafe" },
    { "port": 530, "reason": "unsafe" }, { "port": 531, "reason": "unsafe" },
    { "port": 532, "reason": "unsafe" }, { "port": 540, "reason": "unsafe" },
    { "port": 548, "reason": "unsafe" }, { "port": 554, "reason": "unsafe" },
    { "port": 556, "reason": "unsafe" }, { "port": 563, "reason": "unsafe" },
    { "port": 587, "reason": "unsafe" }, { "port": 601, "reason": "unsafe" },
    { "port": 636, "reason": "unsafe" }, { "port": 989, "reason": "unsafe" },
    { "port": 990, "reason": "unsafe" }, { "port": 993, "reason": "unsafe" },
    { "port": 995, "reason": "unsafe" },
    { "port": 1719, "reason": "unsafe" }, { "port": 1720, "reason": "unsafe" },
    { "port": 1723, "reason": "unsafe" },
    { "port": 2049, "reason": "unsafe" },
    { "port": 3659, "reason": "unsafe" },
    { "port": 4045, "reason": "unsafe" },
    { "port": 4190, "reason": "unsafe" },
    { "port": 5060, "reason": "unsafe" }, { "port": 5061, "reason": "unsafe" },
    { "port": 6000, "reason": "unsafe", "message": "Port 6000 is blocked by browsers. Pick another port." },
    { "port": 6566, "reason": "unsafe" },
    { "port": 6665, "reason": "unsafe" }, { "port": 6666, "reason": "unsafe" },
    { "port": 6667, "reason": "unsafe" }, { "port": 6668, "reason": "unsafe" },
    { "port": 6669, "reason": "unsafe" },
    { "port": 6697, "reason": "unsafe" },
    { "port": 10080, "reason": "unsafe" }
  ],
  "reserved_ranges": [
    { "from": 49152, "to": 65535, "reason": "ephemeral", "message": "Ports 49152-65535 are used automatically by the operating system and may be claimed at any moment. Choose a port below 49152." }
  ],
  "defaults": {
    "base": 8765,
    "span": 100,
    "comment": "8765-8864 is outside the deny list, outside the ephemeral range, and not commonly claimed by developer tooling."
  }
}
